{
  "authority": "NON_CANONICAL_READINESS_EVIDENCE",
  "bootstrap": {
    "full_ledger_read": false,
    "input_allowlist": [
      "repository-routing-metadata",
      "docs/governance/current-state.json",
      "docs/governance/schemas/current-state-v2.schema.json",
      "docs/governance/GOVERNANCE_EFFICIENCY_REFOUNDATION_PHASE_CONTRACT.md",
      "docs/governance/GOVERNANCE_EFFICIENCY_REFOUNDATION_UNIT_4_AUTHORITY_CUTOVER_CONTRACT.md",
      "docs/governance/ledger/g28-ledger-partition-index.json",
      "docs/governance/shadow/ledger/partitions/G28_LEDGER_PART_0012.md"
    ],
    "private_memory_used": false,
    "required_facts_resolved": true
  },
  "bounded_ledger_references": [
    {
      "end_byte": 981128,
      "end_line": 9660,
      "heading": "## 2026-07-23 — GOVERNANCE-EFFICIENCY-REFOUNDATION-UNIT-4-BOOTSTRAP-AUTHORITY-CUTOVER-CONTRACT-R1 — accept Unit 3 and define Unit 4 cutover contract",
      "partition_id": "G28-LEDGER-PART-0012",
      "partition_path": "docs/governance/shadow/ledger/partitions/G28_LEDGER_PART_0012.md",
      "partition_payload_sha256": "d246ed0feef88a33a3f84a8e3718cbdfd28bbd41b99719f4bfdc081c2cdbc08f",
      "phase_order_id": "GOVERNANCE-EFFICIENCY-REFOUNDATION-UNIT-4-BOOTSTRAP-AUTHORITY-CUTOVER-CONTRACT-R1",
      "reason": "Establishes direct Unit 3 acceptance and the Unit 4 contract definition.",
      "start_byte": 978772,
      "start_line": 9650,
      "unit_id": "G28-LEDGER-UNIT-0203",
      "unit_raw_sha256": "e63fa5d30b007a503d9b791ae355a832a28d8a97e39fd47885acfcfefa9bd837"
    },
    {
      "end_byte": 983402,
      "end_line": 9670,
      "heading": "## 2026-07-23 — GOVERNANCE-EFFICIENCY-REFOUNDATION-UNIT-4-CONTRACT-COMMIT-BINDING-AND-CANDIDATE-PATH-CORRECTION-R2 — correct Unit 4 commit binding and candidate paths",
      "partition_id": "G28-LEDGER-PART-0012",
      "partition_path": "docs/governance/shadow/ledger/partitions/G28_LEDGER_PART_0012.md",
      "partition_payload_sha256": "d246ed0feef88a33a3f84a8e3718cbdfd28bbd41b99719f4bfdc081c2cdbc08f",
      "phase_order_id": "GOVERNANCE-EFFICIENCY-REFOUNDATION-UNIT-4-CONTRACT-COMMIT-BINDING-AND-CANDIDATE-PATH-CORRECTION-R2",
      "reason": "Establishes the accepted non-self-referential contract correction.",
      "start_byte": 981128,
      "start_line": 9661,
      "unit_id": "G28-LEDGER-UNIT-0204",
      "unit_raw_sha256": "00ff09bddf2e948a81ab5213b354a0b8b9493854484366b312f10a163e48a286"
    },
    {
      "end_byte": 985271,
      "end_line": 9679,
      "heading": "## 2026-07-23 — GOVERNANCE-EFFICIENCY-REFOUNDATION-UNIT-4A-CUTOVER-READINESS-IMPLEMENTATION-R1 — implement Unit 4A candidate readiness",
      "partition_id": "G28-LEDGER-PART-0012",
      "partition_path": "docs/governance/shadow/ledger/partitions/G28_LEDGER_PART_0012.md",
      "partition_payload_sha256": "d246ed0feef88a33a3f84a8e3718cbdfd28bbd41b99719f4bfdc081c2cdbc08f",
      "phase_order_id": "GOVERNANCE-EFFICIENCY-REFOUNDATION-UNIT-4A-CUTOVER-READINESS-IMPLEMENTATION-R1",
      "reason": "Establishes external contract acceptance, Unit 4A authorization, and current readiness status.",
      "start_byte": 983402,
      "start_line": 9671,
      "unit_id": "G28-LEDGER-UNIT-0205",
      "unit_raw_sha256": "72484e1201f7263f88876d421c3365699c4d83695e020ab249ef18f5531970c7"
    }
  ],
  "build_algorithm": "UNIT4A-DETERMINISTIC-BUILD-V1",
  "consumer_inventory": [
    {
      "changed_in_unit4a": false,
      "disposition": "PROVEN_UNCHANGED_UNTIL_UNIT_4C",
      "evidence": "contract inventory and repository validation",
      "existing_behavior_remains_authoritative": true,
      "implementation_status": "RESOLVED",
      "ordinal": 1,
      "path": "AGENTS.md",
      "rollback_forward_correction": "PRESERVE_OR_FORWARD_CORRECT",
      "unit4c_work_deferred": true
    },
    {
      "changed_in_unit4a": false,
      "disposition": "PROVEN_UNCHANGED_UNTIL_UNIT_4C",
      "evidence": "contract inventory and repository validation",
      "existing_behavior_remains_authoritative": true,
      "implementation_status": "RESOLVED",
      "ordinal": 2,
      "path": "CLAUDE.md",
      "rollback_forward_correction": "PRESERVE_OR_FORWARD_CORRECT",
      "unit4c_work_deferred": true
    },
    {
      "changed_in_unit4a": false,
      "disposition": "PROVEN_UNCHANGED_UNTIL_UNIT_4C",
      "evidence": "contract inventory and repository validation",
      "existing_behavior_remains_authoritative": true,
      "implementation_status": "RESOLVED",
      "ordinal": 3,
      "path": "docs/governance/AGENT_INSTRUCTIONS.md",
      "rollback_forward_correction": "PRESERVE_OR_FORWARD_CORRECT",
      "unit4c_work_deferred": true
    },
    {
      "changed_in_unit4a": false,
      "disposition": "PROVEN_UNCHANGED_UNTIL_UNIT_4C",
      "evidence": "contract inventory and repository validation",
      "existing_behavior_remains_authoritative": true,
      "implementation_status": "RESOLVED",
      "ordinal": 4,
      "path": "docs/governance/DOCUMENTATION_MODEL.md",
      "rollback_forward_correction": "PRESERVE_OR_FORWARD_CORRECT",
      "unit4c_work_deferred": true
    },
    {
      "changed_in_unit4a": false,
      "disposition": "PROVEN_UNCHANGED_UNTIL_UNIT_4C",
      "evidence": "contract inventory and repository validation",
      "existing_behavior_remains_authoritative": true,
      "implementation_status": "RESOLVED",
      "ordinal": 5,
      "path": "docs/governance/SUPERVISION_PROTOCOL.md",
      "rollback_forward_correction": "PRESERVE_OR_FORWARD_CORRECT",
      "unit4c_work_deferred": true
    },
    {
      "changed_in_unit4a": true,
      "disposition": "PROVEN_UNCHANGED_UNTIL_UNIT_4C",
      "evidence": "contract inventory and repository validation",
      "existing_behavior_remains_authoritative": true,
      "implementation_status": "RESOLVED",
      "ordinal": 6,
      "path": "PROJECT_STATE.md",
      "rollback_forward_correction": "PRESERVE_OR_FORWARD_CORRECT",
      "unit4c_work_deferred": true
    },
    {
      "changed_in_unit4a": true,
      "disposition": "PROVEN_UNCHANGED_UNTIL_UNIT_4C",
      "evidence": "contract inventory and repository validation",
      "existing_behavior_remains_authoritative": true,
      "implementation_status": "RESOLVED",
      "ordinal": 7,
      "path": "AGENT_HANDOFF.md",
      "rollback_forward_correction": "PRESERVE_OR_FORWARD_CORRECT",
      "unit4c_work_deferred": true
    },
    {
      "changed_in_unit4a": true,
      "disposition": "PROVEN_UNCHANGED_UNTIL_UNIT_4C",
      "evidence": "contract inventory and repository validation",
      "existing_behavior_remains_authoritative": true,
      "implementation_status": "RESOLVED",
      "ordinal": 8,
      "path": "docs/DOCUMENTATION_INDEX.md",
      "rollback_forward_correction": "PRESERVE_OR_FORWARD_CORRECT",
      "unit4c_work_deferred": true
    },
    {
      "changed_in_unit4a": false,
      "disposition": "PROVEN_UNCHANGED_UNTIL_UNIT_4C",
      "evidence": "contract inventory and repository validation",
      "existing_behavior_remains_authoritative": true,
      "implementation_status": "RESOLVED",
      "ordinal": 9,
      "path": "docs/architecture/ORDEM_COMPRA_C3_TRACEABILITY.md",
      "rollback_forward_correction": "PRESERVE_OR_FORWARD_CORRECT",
      "unit4c_work_deferred": true
    },
    {
      "changed_in_unit4a": true,
      "disposition": "PROVEN_UNCHANGED_UNTIL_UNIT_4C",
      "evidence": "contract inventory and repository validation",
      "existing_behavior_remains_authoritative": true,
      "implementation_status": "RESOLVED",
      "ordinal": 10,
      "path": "docs/governance/GOVERNANCE_EFFICIENCY_REFOUNDATION_PHASE_CONTRACT.md",
      "rollback_forward_correction": "PRESERVE_OR_FORWARD_CORRECT",
      "unit4c_work_deferred": true
    },
    {
      "changed_in_unit4a": false,
      "disposition": "PROVEN_UNCHANGED_UNTIL_UNIT_4C",
      "evidence": "contract inventory and repository validation",
      "existing_behavior_remains_authoritative": true,
      "implementation_status": "RESOLVED",
      "ordinal": 11,
      "path": "scripts/validate-spec-custody.mjs",
      "rollback_forward_correction": "PRESERVE_OR_FORWARD_CORRECT",
      "unit4c_work_deferred": true
    },
    {
      "changed_in_unit4a": false,
      "disposition": "PROVEN_UNCHANGED_UNTIL_UNIT_4C",
      "evidence": "contract inventory and repository validation",
      "existing_behavior_remains_authoritative": true,
      "implementation_status": "RESOLVED",
      "ordinal": 12,
      "path": "scripts/spec-custody/validation-core.mjs",
      "rollback_forward_correction": "PRESERVE_OR_FORWARD_CORRECT",
      "unit4c_work_deferred": true
    },
    {
      "changed_in_unit4a": false,
      "disposition": "PROVEN_UNCHANGED_UNTIL_UNIT_4C",
      "evidence": "contract inventory and repository validation",
      "existing_behavior_remains_authoritative": true,
      "implementation_status": "RESOLVED",
      "ordinal": 13,
      "path": "scripts/spec-custody/self-tests.mjs",
      "rollback_forward_correction": "PRESERVE_OR_FORWARD_CORRECT",
      "unit4c_work_deferred": true
    },
    {
      "changed_in_unit4a": false,
      "disposition": "IMPLEMENTED_FOR_CANDIDATE_READINESS",
      "evidence": "contract inventory and repository validation",
      "existing_behavior_remains_authoritative": true,
      "implementation_status": "RESOLVED",
      "ordinal": 14,
      "path": "scripts/governance/build-current-state-source-manifest.mjs",
      "rollback_forward_correction": "PRESERVE_OR_FORWARD_CORRECT",
      "unit4c_work_deferred": true
    },
    {
      "changed_in_unit4a": false,
      "disposition": "IMPLEMENTED_FOR_CANDIDATE_READINESS",
      "evidence": "contract inventory and repository validation",
      "existing_behavior_remains_authoritative": true,
      "implementation_status": "RESOLVED",
      "ordinal": 15,
      "path": "scripts/governance/render-current-state-shadow.mjs",
      "rollback_forward_correction": "PRESERVE_OR_FORWARD_CORRECT",